{"account_username_sha256":"809cd2b0e14ad028438ad5a0a7af801dce013a86a3f1d62926a605177198389b","chunker_polynomial":"255a608adc8769","completed_at":"2026-08-26T01:36:31Z","helper_sha256":"80b7fb8e7dd3ff0e2afd7bb91b668281c426256a70c37a8e9b1b3ff75a602694","lock_owner_sha256":"7e190cab8eaf7062b260fe6ab6b3c253ef8abccb360f878758a95de99717d678","mounts":{"games":"pass","nfs":"pass"},"operations":["init-games","init-nfs-from-games-copy-chunker-params","normalize-games-access","init-proton-from-games-copy-chunker-params"],"proton_minimum_allocated_bytes":1000000000000,"proton_minimum_free_bytes":100000000000,"proton_observed_free_bytes":1073741815648,"proton_observed_total_bytes":1073741824000,"qualification_evidence_sha256":"81f93aca27a87fe38d90137f33da60d823ed5e391296c95cb7ab1be867dfc679","rclone_sha256":"f3f9aff817f9766029e50adf9a7963c169e475b8f10c7927823568a0d9443db7","repository_ids":{"games":"b15627185df9b10a95b5dffe7d194dbccdba6ba4eb8a038ee03e750fedbde08f","nfs":"61d50fa782d194374deb24f354a07b0f11634721afa1b268963e4d017b93bb95","proton":"d1faa9cd772dd13275b8d4db376c2bbba0b82a9415a28b0d03a8b17e37b7fb7e"},"restic_sha256":"20d4142678d0d95ec11a4759def1b73fd9190abc9ca19e4b62d067c0b387e639","source_policy_sha256":"7ec54b69a21e118f5b6ef6c9d3a73cdbb8c16cbe0629491fcad0c782227e2501","started_at":"2026-08-26T01:35:34Z","state":"initialized","type":"restic-repository-initialization","version":1}
